{
  "$schema": "https://json-schema.org/draft/2020-12/schema",
  "$id": "packages/game-content/schemas/quest.schema.json",
  "title": "Normalized quest definition (legacy goals domain)",
  "description": "Contract for one normalized quest: one stored legacy goals entry. Native integer id and reward are kept verbatim (rule Q3); title, description, and hint are strings with the uniformly-empty hint preserved (rule Q3). See packages/game-content/README.md for the rule set and survey citations.",
  "type": "object",
  "required": [
    "legacy_id",
    "kind",
    "source_file",
    "source_layer",
    "content_version",
    "id",
    "title",
    "hint",
    "description",
    "reward"
  ],
  "additionalProperties": false,
  "properties": {
    "legacy_id": {
      "type": "string",
      "description": "Stored goals id preserved verbatim as a string (rule Q4): the decimal form of the native integer id."
    },
    "kind": {
      "const": "quest",
      "description": "Classification of the stored goals domain: every goals entry maps to quest."
    },
    "source_file": {
      "type": "string",
      "description": "Origin file of the stored entry: config/main.json (no patch targets goals)."
    },
    "source_layer": {
      "type": "string",
      "description": "Layering origin: stored (no patch targets goals)."
    },
    "content_version": {
      "type": "string",
      "description": "Content fingerprint (sha256 over the stored source bytes plus the mods list); sources carry no version stamp."
    },
    "id": {
      "type": "integer",
      "description": "Native stored goals id, kept verbatim (rule Q3)."
    },
    "title": {
      "type": "string",
      "description": "Quest title, preserved verbatim (rule Q3)."
    },
    "hint": {
      "type": "string",
      "description": "Quest hint, preserved verbatim; empty in all 91 stored entries (rule Q3, uniformity noted in the manifest)."
    },
    "description": {
      "type": "string",
      "description": "Quest description, preserved verbatim (rule Q3)."
    },
    "reward": {
      "type": "integer",
      "description": "Quest reward, preserved verbatim; uniformly 10 in all 91 stored entries (rule Q3, uniformity noted in the manifest).",
      "minimum": 0
    }
  }
}
