[
  {
    "legacy_id": "2",
    "kind": "quest",
    "source_file": "config/main.json",
    "source_layer": "stored",
    "content_version": "004ba829043dfb00d78888a764bd7e13a37db9c5c05195cd910ac3d570678bb3",
    "id": 2,
    "title": "Train another Villager",
    "hint": "",
    "description": "You need villagers to collect resources. Select your townhall, click on the button 'train villager' that appears at the bottom panel",
    "reward": 10
  },
  {
    "legacy_id": "3",
    "kind": "quest",
    "source_file": "config/main.json",
    "source_layer": "stored",
    "content_version": "004ba829043dfb00d78888a764bd7e13a37db9c5c05195cd910ac3d570678bb3",
    "id": 3,
    "title": "Send a villager to the farm",
    "hint": "",
    "description": "Your farm needs villagers to begin producing food. First click on a villager and then click on the farm.",
    "reward": 10
  },
  {
    "legacy_id": "4",
    "kind": "quest",
    "source_file": "config/main.json",
    "source_layer": "stored",
    "content_version": "004ba829043dfb00d78888a764bd7e13a37db9c5c05195cd910ac3d570678bb3",
    "id": 4,
    "title": "Collect a farm",
    "hint": "",
    "description": "When the farm is ready to collect, you must click on it to get the resources. An icon will notice you that it is ready.",
    "reward": 10
  },
  {
    "legacy_id": "5",
    "kind": "quest",
    "source_file": "config/main.json",
    "source_layer": "stored",
    "content_version": "004ba829043dfb00d78888a764bd7e13a37db9c5c05195cd910ac3d570678bb3",
    "id": 5,
    "title": "Cut 7 trees and collect wood",
    "hint": "",
    "description": "You got food and now you need wood. There are a lot of trees arround your village. Click on a villager and then click on the tree you want to chop down.",
    "reward": 10
  },
  {
    "legacy_id": "6",
    "kind": "quest",
    "source_file": "config/main.json",
    "source_layer": "stored",
    "content_version": "004ba829043dfb00d78888a764bd7e13a37db9c5c05195cd910ac3d570678bb3",
    "id": 6,
    "title": "Build another Farm",
    "hint": "",
    "description": "Farms are essential to increase your empire, cause they provide you food. Go to the build menu and place a farm.",
    "reward": 10
  },
  {
    "legacy_id": "7",
    "kind": "quest",
    "source_file": "config/main.json",
    "source_layer": "stored",
    "content_version": "004ba829043dfb00d78888a764bd7e13a37db9c5c05195cd910ac3d570678bb3",
    "id": 7,
    "title": "Build another House",
    "hint": "",
    "description": "People live in houses! The more houses you build, the more units you can train. You can see the current population limit at the top right corner.",
    "reward": 10
  },
  {
    "legacy_id": "8",
    "kind": "quest",
    "source_file": "config/main.json",
    "source_layer": "stored",
    "content_version": "004ba829043dfb00d78888a764bd7e13a37db9c5c05195cd910ac3d570678bb3",
    "id": 8,
    "title": "Build a barracks",
    "hint": "",
    "description": "Prepare for the battle! You need an army. Click on the 'Build' button, select the 'Attack' category and finally click on the Barracks building.",
    "reward": 10
  },
  {
    "legacy_id": "9",
    "kind": "quest",
    "source_file": "config/main.json",
    "source_layer": "stored",
    "content_version": "004ba829043dfb00d78888a764bd7e13a37db9c5c05195cd910ac3d570678bb3",
    "id": 9,
    "title": "Train 3 spearmen",
    "hint": "",
    "description": "Start building your army with spearmen. Click on the barracks building, the bottom panel will appear, search the 'train spearman' button and click on it. Repeat this 3 times.",
    "reward": 10
  },
  {
    "legacy_id": "10",
    "kind": "quest",
    "source_file": "config/main.json",
    "source_layer": "stored",
    "content_version": "004ba829043dfb00d78888a764bd7e13a37db9c5c05195cd910ac3d570678bb3",
    "id": 10,
    "title": "Build a mill",
    "hint": "",
    "description": "Mill will provide you some food, like farms. Build one using the build menu!",
    "reward": 10
  },
  {
    "legacy_id": "11",
    "kind": "quest",
    "source_file": "config/main.json",
    "source_layer": "stored",
    "content_version": "004ba829043dfb00d78888a764bd7e13a37db9c5c05195cd910ac3d570678bb3",
    "id": 11,
    "title": "Bring a villager to the mill",
    "hint": "",
    "description": "Mills don't work alone! They need villagers. Select a villager and click on the mill.",
    "reward": 10
  },
  {
    "legacy_id": "12",
    "kind": "quest",
    "source_file": "config/main.json",
    "source_layer": "stored",
    "content_version": "004ba829043dfb00d78888a764bd7e13a37db9c5c05195cd910ac3d570678bb3",
    "id": 12,
    "title": "Extract 3 of gold",
    "hint": "",
    "description": "Gold will make you more powerful! It is used to train the best units. Select a villager and click on a gold vein  (Explore the map to find gold veins)",
    "reward": 10
  },
  {
    "legacy_id": "13",
    "kind": "quest",
    "source_file": "config/main.json",
    "source_layer": "stored",
    "content_version": "004ba829043dfb00d78888a764bd7e13a37db9c5c05195cd910ac3d570678bb3",
    "id": 13,
    "title": "Kill 3 trolls",
    "hint": "",
    "description": "Let's have some fun! Pick your army with the 'square' button, find some trolls near your empire and click on them to start the battle.",
    "reward": 10
  },
  {
    "legacy_id": "14",
    "kind": "quest",
    "source_file": "config/main.json",
    "source_layer": "stored",
    "content_version": "004ba829043dfb00d78888a764bd7e13a37db9c5c05195cd910ac3d570678bb3",
    "id": 14,
    "title": "Build a sheep ranch",
    "hint": "",
    "description": "Sheeps are funny! But they need a sheep ranch! Build one using the build menu. It will provide you some food!",
    "reward": 10
  },
  {
    "legacy_id": "15",
    "kind": "quest",
    "source_file": "config/main.json",
    "source_layer": "stored",
    "content_version": "004ba829043dfb00d78888a764bd7e13a37db9c5c05195cd910ac3d570678bb3",
    "id": 15,
    "title": "Capture a sheep",
    "hint": "",
    "description": "Ok! If you already got a sheep ranch, now go for some sheeps. Select a villager and click on a sheep to capture it.",
    "reward": 10
  },
  {
    "legacy_id": "16",
    "kind": "quest",
    "source_file": "config/main.json",
    "source_layer": "stored",
    "content_version": "004ba829043dfb00d78888a764bd7e13a37db9c5c05195cd910ac3d570678bb3",
    "id": 16,
    "title": "Bring a sheep to the ranch",
    "hint": "",
    "description": "You own a sheep! It will go where you want. Select it and send it to the ranch.",
    "reward": 10
  },
  {
    "legacy_id": "17",
    "kind": "quest",
    "source_file": "config/main.json",
    "source_layer": "stored",
    "content_version": "004ba829043dfb00d78888a764bd7e13a37db9c5c05195cd910ac3d570678bb3",
    "id": 17,
    "title": "Collect a sheep ranch",
    "hint": "",
    "description": "When a sheep ranch is ready to collect (you will notice the icon), click on it!",
    "reward": 10
  },
  {
    "legacy_id": "18",
    "kind": "quest",
    "source_file": "config/main.json",
    "source_layer": "stored",
    "content_version": "004ba829043dfb00d78888a764bd7e13a37db9c5c05195cd910ac3d570678bb3",
    "id": 18,
    "title": "Build 5 farms",
    "hint": "",
    "description": "With one farm you will not conquer the world! Build 5 of them.",
    "reward": 10
  },
  {
    "legacy_id": "19",
    "kind": "quest",
    "source_file": "config/main.json",
    "source_layer": "stored",
    "content_version": "004ba829043dfb00d78888a764bd7e13a37db9c5c05195cd910ac3d570678bb3",
    "id": 19,
    "title": "Build 8 houses",
    "hint": "",
    "description": "Build 8 houses to increase your population limit.",
    "reward": 10
  },
  {
    "legacy_id": "20",
    "kind": "quest",
    "source_file": "config/main.json",
    "source_layer": "stored",
    "content_version": "004ba829043dfb00d78888a764bd7e13a37db9c5c05195cd910ac3d570678bb3",
    "id": 20,
    "title": "Build 1 gold mine",
    "hint": "",
    "description": "Gold can also be obtained from gold mines, buy you can only own one. Build it!",
    "reward": 10
  },
  {
    "legacy_id": "21",
    "kind": "quest",
    "source_file": "config/main.json",
    "source_layer": "stored",
    "content_version": "004ba829043dfb00d78888a764bd7e13a37db9c5c05195cd910ac3d570678bb3",
    "id": 21,
    "title": "Put 1 villager into the mine",
    "hint": "",
    "description": "Gold mines need villagers to extract the gold. Bring one of them to the mine.",
    "reward": 10
  },
  {
    "legacy_id": "22",
    "kind": "quest",
    "source_file": "config/main.json",
    "source_layer": "stored",
    "content_version": "004ba829043dfb00d78888a764bd7e13a37db9c5c05195cd910ac3d570678bb3",
    "id": 22,
    "title": "Build an archery",
    "hint": "",
    "description": "An archery will allow you to train archer infantry. Archers have a longer range than normal infantry.",
    "reward": 10
  },
  {
    "legacy_id": "23",
    "kind": "quest",
    "source_file": "config/main.json",
    "source_layer": "stored",
    "content_version": "004ba829043dfb00d78888a764bd7e13a37db9c5c05195cd910ac3d570678bb3",
    "id": 23,
    "title": "Train 3 light archers",
    "hint": "",
    "description": "Train 3 light archers at your archery! Remember, click the archery an then click the train light archer button at the bottom.",
    "reward": 10
  },
  {
    "legacy_id": "24",
    "kind": "quest",
    "source_file": "config/main.json",
    "source_layer": "stored",
    "content_version": "004ba829043dfb00d78888a764bd7e13a37db9c5c05195cd910ac3d570678bb3",
    "id": 24,
    "title": "Kill 5 trolls",
    "hint": "",
    "description": "It's time to kill trolls! Meet your army and go for trolls. These creatures are not good for your empire!",
    "reward": 10
  },
  {
    "legacy_id": "25",
    "kind": "quest",
    "source_file": "config/main.json",
    "source_layer": "stored",